rating,reviewer_id,date,review_title,review_body,category,score_gemini,score_groq,tokens,bing_prediction,swn_prediction
5.0,lisa,2026-02-11,,buy brand vegetable oil many years great value price always taste fresh no reason spend oil great expensive brand,food,5.0,5.0,"['buy', 'brand', 'vegetable', 'oil', 'many', 'years', 'great', 'value', 'price', 'always', 'taste', 'fresh', 'no', 'reason', 'spend', 'oil', 'great', 'expensive', 'brand']",1,1
5.0,mary,2026-03-03,,refresh know still find pantry staple walmart pice still affordable available change go food days good job walmart,food,5.0,5.0,"['refresh', 'know', 'still', 'find', 'pantry', 'staple', 'walmart', 'pice', 'still', 'affordable', 'available', 'change', 'go', 'food', 'days', 'good', 'job', 'walmart']",1,1
5.0,barbara,2025-10-31,good cook oil,great value cook oil delicious recipes require deep fry doesnt affect taste food wonderful fry chicken pork chop sea food price value good,food,3.0,5.0,"['great', 'value', 'cook', 'oil', 'delicious', 'recipes', 'require', 'deep', 'fry', 'doesnt', 'affect', 'taste', 'food', 'wonderful', 'fry', 'chicken', 'pork', 'chop', 'sea', 'food', 'price', 'value', 'good']",1,1
4.0,william,2026-03-04,decent oil cheap price,probably not health food decent enough cook need large volume oil deep fry definitely trick decent basic oil cheap price,food,2.0,3.0,"['probably', 'not', 'health', 'food', 'decent', 'enough', 'cook', 'need', 'large', 'volume', 'oil', 'deep', 'fry', 'definitely', 'trick', 'decent', 'basic', 'oil', 'cheap', 'price']",0,1
4.0,luciana,2025-07-31,versatile every day use,youre look highly affordable neutralflavored cook oil everyday fry bake great value vegetable oil 48 fl oz solid pick perform reliably offer excellent bang buck however youre seek healthieror flavorsensitiveoption consider swap avocado olive oil cold use canolasunflower lighter nutritional profile,food,4.0,5.0,"['youre', 'look', 'highly', 'affordable', 'neutralflavored', 'cook', 'oil', 'everyday', 'fry', 'bake', 'great', 'value', 'vegetable', 'oil', '48', 'fl', 'oz', 'solid', 'pick', 'perform', 'reliably', 'offer', 'excellent', 'bang', 'buck', 'however', 'youre', 'seek', 'healthieror', 'flavorsensitiveoption', 'consider', 'swap', 'avocado', 'olive', 'oil', 'cold', 'use', 'canolasunflower', 'lighter', 'nutritional', 'profile']",1,1
5.0,paul,2025-07-31,,great value brand cookingsalad oil go brand need good vegetable oil economicaland quality excellent ive shop around lot youre go difficult time try beat walmart price plusthis oil soybean oil definitely dont problem soybeansthank walmart,food,4.0,5.0,"['great', 'value', 'brand', 'cookingsalad', 'oil', 'go', 'brand', 'need', 'good', 'vegetable', 'oil', 'economicaland', 'quality', 'excellent', 'ive', 'shop', 'around', 'lot', 'youre', 'go', 'difficult', 'time', 'try', 'beat', 'walmart', 'price', 'plusthis', 'oil', 'soybean', 'oil', 'definitely', 'dont', 'problem', 'soybeansthank', 'walmart']",1,1
5.0,nekondeh,2025-08-01,give justin raise asap,justin wonderful customer service drive timely efficient ive use pickup since first begin 6 years ago pickup people generally wonderful need figure keep good employees justin best,food,5.0,5.0,"['justin', 'wonderful', 'customer', 'service', 'drive', 'timely', 'efficient', 'ive', 'use', 'pickup', 'since', 'first', 'begin', '6', 'years', 'ago', 'pickup', 'people', 'generally', 'wonderful', 'need', 'figure', 'keep', 'good', 'employees', 'justin', 'best']",1,1
5.0,rachel,2025-08-23,name brand not make anything better,use buy name brand products recently groceries overprice ive buy store brand come conclusion buy certain name doesnt make better great value veg oil good others lower price,food,1.0,4.0,"['use', 'buy', 'name', 'brand', 'products', 'recently', 'groceries', 'overprice', 'ive', 'buy', 'store', 'brand', 'come', 'conclusion', 'buy', 'certain', 'name', 'doesnt', 'make', 'better', 'great', 'value', 'veg', 'oil', 'good', 'others', 'lower', 'price']",1,1
4.0,judy,2025-07-31,date bread,bread send best buy date july 30 yesterday 31st pick think pick loaves bread even milk look best buy date pick furthest date ive never problems milk bread yesterday probably not gonna last long go bad,food,2.0,1.0,"['bread', 'send', 'best', 'buy', 'date', 'july', '30', 'yesterday', '31st', 'pick', 'think', 'pick', 'loaves', 'bread', 'even', 'milk', 'look', 'best', 'buy', 'date', 'pick', 'furthest', 'date', 'ive', 'never', 'problems', 'milk', 'bread', 'yesterday', 'probably', 'not', 'gonna', 'last', 'long', 'go', 'bad']",1,1
5.0,tim,2025-08-10,oil try,grandfather 15 grandkids take lot cook oil think oil best buy money need less cook pan add mix dose well mix kind cake mix food cook fryers pot dept fryer no bad taste price well lowest price others try use cook even hand ay end day thank ask think product tim caudill,food,4.0,5.0,"['grandfather', '15', 'grandkids', 'take', 'lot', 'cook', 'oil', 'think', 'oil', 'best', 'buy', 'money', 'need', 'less', 'cook', 'pan', 'add', 'mix', 'dose', 'well', 'mix', 'kind', 'cake', 'mix', 'food', 'cook', 'fryers', 'pot', 'dept', 'fryer', 'no', 'bad', 'taste', 'price', 'well', 'lowest', 'price', 'others', 'try', 'use', 'cook', 'even', 'hand', 'ay', 'end', 'day', 'thank', 'ask', 'think', 'product', 'tim', 'caudill']",1,1
5.0,walmart customer,2024-05-07,oiloil,oil oil may fry bake buy expensive oil,food,2.0,1.0,"['oil', 'oil', 'may', 'fry', 'bake', 'buy', 'expensive', 'oil']",0,0
1.0,k,2023-09-21,vegetable oil,look like vegetable oil drop,food,1.0,2.0,"['look', 'like', 'vegetable', 'oil', 'drop']",1,1
5.0,linda,2025-10-14,,always fresh last days always fresh last days like freeze defrost flavorful first buy like freeze defrost flavorful first buy,food,2.0,5.0,"['always', 'fresh', 'last', 'days', 'always', 'fresh', 'last', 'days', 'like', 'freeze', 'defrost', 'flavorful', 'first', 'buy', 'like', 'freeze', 'defrost', 'flavorful', 'first', 'buy']",1,1
4.0,bhargavi,2025-09-27,,flexible cap whenever use oil leak drop come top bottom bottle bottle become muddy sticky please take issue seriously,food,1.0,1.0,"['flexible', 'cap', 'whenever', 'use', 'oil', 'leak', 'drop', 'come', 'top', 'bottom', 'bottle', 'bottle', 'become', 'muddy', 'sticky', 'please', 'take', 'issue', 'seriously']",0,0
5.0,cd,2025-09-17,quality price great,quality price great fry chicken fry always come crunchy outside tender inside best buy youre watch dollars,food,3.0,5.0,"['quality', 'price', 'great', 'fry', 'chicken', 'fry', 'always', 'come', 'crunchy', 'outside', 'tender', 'inside', 'best', 'buy', 'youre', 'watch', 'dollars']",1,1
5.0,neil,2025-05-30,ideal cook oil,gv cook oil diesnt add extra flavor whatever cook ideal finicky palates use neesd add oil coat skillet add mix call oil also fairly high temperature tolerance doesnt smoke discolor skillets pan highly recommend,food,4.0,5.0,"['gv', 'cook', 'oil', 'diesnt', 'add', 'extra', 'flavor', 'whatever', 'cook', 'ideal', 'finicky', 'palates', 'use', 'neesd', 'add', 'oil', 'coat', 'skillet', 'add', 'mix', 'call', 'oil', 'also', 'fairly', 'high', 'temperature', 'tolerance', 'doesnt', 'smoke', 'discolor', 'skillets', 'pan', 'highly', 'recommend']",1,1
5.0,melba,2025-05-28,,buy great value products lot theyre budget friendly good name brand vegetable oil taste no different name brand make food taste good use time highly recommend recommend,food,4.0,5.0,"['buy', 'great', 'value', 'products', 'lot', 'theyre', 'budget', 'friendly', 'good', 'name', 'brand', 'vegetable', 'oil', 'taste', 'no', 'different', 'name', 'brand', 'make', 'food', 'taste', 'good', 'use', 'time', 'highly', 'recommend', 'recommend']",1,1
5.0,thomas,2025-07-11,nothing taste better cook oil,slight difference taste premium king oil cook suchcalvin crisco value thru roof bottle add cup half free price 2 king not surprise advise,food,3.0,4.0,"['slight', 'difference', 'taste', 'premium', 'king', 'oil', 'cook', 'suchcalvin', 'crisco', 'value', 'thru', 'roof', 'bottle', 'add', 'cup', 'half', 'free', 'price', '2', 'king', 'not', 'surprise', 'advise']",1,1
5.0,ella,2022-07-08,really good oil,really good oil switch great value brand buy items gv brand not price sometimes price quality always top notch italian sausages better premio pay gv sausages anytime,food,4.0,5.0,"['really', 'good', 'oil', 'switch', 'great', 'value', 'brand', 'buy', 'items', 'gv', 'brand', 'not', 'price', 'sometimes', 'price', 'quality', 'always', 'top', 'notch', 'italian', 'sausages', 'better', 'premio', 'pay', 'gv', 'sausages', 'anytime']",1,1
5.0,naomi,2025-05-26,vegetable oil,vegetable oil say great vegetables perfect cake get dont think work car good didnt get car another note vegetable oil use lot things add water pasta put rise dough hand knead dough put meat kind help hold spice little oil pan also help keep stick crisp meat time vegetable oil go one work,food,3.0,5.0,"['vegetable', 'oil', 'say', 'great', 'vegetables', 'perfect', 'cake', 'get', 'dont', 'think', 'work', 'car', 'good', 'didnt', 'get', 'car', 'another', 'note', 'vegetable', 'oil', 'use', 'lot', 'things', 'add', 'water', 'pasta', 'put', 'rise', 'dough', 'hand', 'knead', 'dough', 'put', 'meat', 'kind', 'help', 'hold', 'spice', 'little', 'oil', 'pan', 'also', 'help', 'keep', 'stick', 'crisp', 'meat', 'time', 'vegetable', 'oil', 'go', 'one', 'work']",1,1
5.0,sandy,2026-02-19,must bake need,use bread make cake bake cookies no complaints everything good blance moisture,food,5.0,5.0,"['use', 'bread', 'make', 'cake', 'bake', 'cookies', 'no', 'complaints', 'everything', 'good', 'blance', 'moisture']",0,1
5.0,rita,2026-02-20,,good oil cook fry bake work well bake need good fry make french fry crispy,food,4.0,5.0,"['good', 'oil', 'cook', 'fry', 'bake', 'work', 'well', 'bake', 'need', 'good', 'fry', 'make', 'french', 'fry', 'crispy']",1,1
5.0,michael,2025-12-14,good price 26 good quality product,oil good name brand vegetable oil fry stuff cook bake,food,4.0,5.0,"['oil', 'good', 'name', 'brand', 'vegetable', 'oil', 'fry', 'stuff', 'cook', 'bake']",1,1
5.0,rn2tired,2025-11-01,good,vegetable oil great fry good name brand much cheaper choose great value oil others,food,4.0,5.0,"['vegetable', 'oil', 'great', 'fry', 'good', 'name', 'brand', 'much', 'cheaper', 'choose', 'great', 'value', 'oil', 'others']",1,1
5.0,leslie,2025-11-03,,oil gods sake really matter make vegetable oil want taste go buy flavor oil like olive oil,food,2.0,1.0,"['oil', 'gods', 'sake', 'really', 'matter', 'make', 'vegetable', 'oil', 'want', 'taste', 'go', 'buy', 'flavor', 'oil', 'like', 'olive', 'oil']",1,1
5.0,theqjb,2025-10-16,great value vegetable oil,good alternative brand without inflate price high smoke point overall better option mg budget,food,5.0,5.0,"['good', 'alternative', 'brand', 'without', 'inflate', 'price', 'high', 'smoke', 'point', 'overall', 'better', 'option', 'mg', 'budget']",1,1
4.0,cynthia,2025-10-27,ok value,sorry not much fan oil seem like take longer cook foods brand,food,4.0,2.0,"['sorry', 'not', 'much', 'fan', 'oil', 'seem', 'like', 'take', 'longer', 'cook', 'foods', 'brand']",0,1
5.0,maryhelen,2025-11-02,good product good value,really cant remember use another vegetable oil ive cook years bake fry good price,food,3.0,5.0,"['really', 'cant', 'remember', 'use', 'another', 'vegetable', 'oil', 'ive', 'cook', 'years', 'bake', 'fry', 'good', 'price']",1,1
5.0,jeff,2025-10-15,work,cheap fry oil tendency burn lower expect temperatures expect use cheap oil,food,2.0,2.0,"['cheap', 'fry', 'oil', 'tendency', 'burn', 'lower', 'expect', 'temperatures', 'expect', 'use', 'cheap', 'oil']",1,1
5.0,cillo,2025-11-02,,price especially budget great product order use product time,food,1.0,5.0,"['price', 'especially', 'budget', 'great', 'product', 'order', 'use', 'product', 'time']",1,1
5.0,ashley,2025-11-01,,vegetable oil work like need vegetable oil budget grab great value vegetable oil,food,4.0,5.0,"['vegetable', 'oil', 'work', 'like', 'need', 'vegetable', 'oil', 'budget', 'grab', 'great', 'value', 'vegetable', 'oil']",1,1
5.0,susan,2025-11-10,,work great french fry family love way fry taste fry occasional treat rather air fry bake,food,4.0,5.0,"['work', 'great', 'french', 'fry', 'family', 'love', 'way', 'fry', 'taste', 'fry', 'occasional', 'treat', 'rather', 'air', 'fry', 'bake']",1,1
1.0,suckit,2025-11-12,,didnt get didnt get refund walmart worst work ethic customer service liars thieve shop krogers,food,4.0,1.0,"['didnt', 'get', 'didnt', 'get', 'refund', 'walmart', 'worst', 'work', 'ethic', 'customer', 'service', 'liars', 'thieve', 'shop', 'krogers']",0,0
5.0,narendra,2025-11-14,,li would highly recommend customers edible good health no irritate strong smell,food,1.0,5.0,"['li', 'would', 'highly', 'recommend', 'customers', 'edible', 'good', 'health', 'no', 'irritate', 'strong', 'smell']",1,1
5.0,betty,2025-11-23,,buy price dont complaints good pricier brand name,food,4.0,5.0,"['buy', 'price', 'dont', 'complaints', 'good', 'pricier', 'brand', 'name']",1,1
5.0,hester,2025-11-22,,trust walmart great value label present good quality food products lower price deliver,food,4.0,5.0,"['trust', 'walmart', 'great', 'value', 'label', 'present', 'good', 'quality', 'food', 'products', 'lower', 'price', 'deliver']",1,1
5.0,david,2025-12-28,,great go oil need especially like potatoes caramelize onions,food,4.0,5.0,"['great', 'go', 'oil', 'need', 'especially', 'like', 'potatoes', 'caramelize', 'onions']",1,1
5.0,joannaisha,2025-12-25,walmart brand excellent,purchase oil use find work perfect need no reason pay extra name brand,food,4.0,5.0,"['purchase', 'oil', 'use', 'find', 'work', 'perfect', 'need', 'no', 'reason', 'pay', 'extra', 'name', 'brand']",1,1
5.0,rebecca,2025-12-29,great value good name brand,use lot bake poppyseed bread everyone love bread great vegetable oil good name brand,food,2.0,5.0,"['use', 'lot', 'bake', 'poppyseed', 'bread', 'everyone', 'love', 'bread', 'great', 'vegetable', 'oil', 'good', 'name', 'brand']",1,1
5.0,pamela,2026-01-02,,dont use lot oil cook also reuse oil without bad taste taste burn,food,1.0,1.0,"['dont', 'use', 'lot', 'oil', 'cook', 'also', 'reuse', 'oil', 'without', 'bad', 'taste', 'taste', 'burn']",0,0
5.0,anna,2026-01-07,love food mainly chicken,love oil try keep much oil system though child lovely teens try nice jeans try cut oil bake,food,4.0,5.0,"['love', 'oil', 'try', 'keep', 'much', 'oil', 'system', 'though', 'child', 'lovely', 'teens', 'try', 'nice', 'jeans', 'try', 'cut', 'oil', 'bake']",1,1
5.0,debbie,2026-01-08,healthy egg,egg good usually like 24 egg pack not available settle 12 pack good value,food,3.0,4.0,"['egg', 'good', 'usually', 'like', '24', 'egg', 'pack', 'not', 'available', 'settle', '12', 'pack', 'good', 'value']",1,1
5.0,caitlin,2026-01-07,great product,good product use make latkes holiday taste great buy,food,5.0,5.0,"['good', 'product', 'use', 'make', 'latkes', 'holiday', 'taste', 'great', 'buy']",1,1
4.0,artisha,2026-02-21,,like great price dislike get black 1 use use fudgy browniesand dont dry fast,food,2.0,2.0,"['like', 'great', 'price', 'dislike', 'get', 'black', '1', 'use', 'use', 'fudgy', 'browniesand', 'dont', 'dry', 'fast']",1,1
3.0,teresa,2026-02-01,,oil okay small bottle hard sheriffs plastic flimsy sqeezed durjng open oil everywhere,food,1.0,1.0,"['oil', 'okay', 'small', 'bottle', 'hard', 'sheriffs', 'plastic', 'flimsy', 'sqeezed', 'durjng', 'open', 'oil', 'everywhere']",0,0
5.0,edilsa,2026-02-09,,oil use fry doesnt leave oily taste start use bake also work great,food,4.0,5.0,"['oil', 'use', 'fry', 'doesnt', 'leave', 'oily', 'taste', 'start', 'use', 'bake', 'also', 'work', 'great']",1,1
5.0,dolores,2026-02-07,,good taste like flavor wise isnt rich price good always go recommend 100,food,5.0,5.0,"['good', 'taste', 'like', 'flavor', 'wise', 'isnt', 'rich', 'price', 'good', 'always', 'go', 'recommend', '100']",1,1
5.0,auntiefaith,2026-02-10,good name brand,use great value oil bake fewtimes fry something oil light doesnt power taste food,food,4.0,5.0,"['use', 'great', 'value', 'oil', 'bake', 'fewtimes', 'fry', 'something', 'oil', 'light', 'doesnt', 'power', 'taste', 'food']",1,1
5.0,steve,2025-05-04,great watch eagle destroy chiefs,buy could experience amaze playoff run 20242025 philadelphia eagle go bird use centerpiece outdoor party tent watch eagle completly destroy kc chiefs beautiful watch superbowl 37 time last 3 monthsit best day life projector well worth money,electronics,2.0,5.0,"['buy', 'could', 'experience', 'amaze', 'playoff', 'run', '20242025', 'philadelphia', 'eagle', 'go', 'bird', 'use', 'centerpiece', 'outdoor', 'party', 'tent', 'watch', 'eagle', 'completly', 'destroy', 'kc', 'chiefs', 'beautiful', 'watch', 'superbowl', '37', 'time', 'last', '3', 'monthsit', 'best', 'day', 'life', 'projector', 'well', 'worth', 'money']",1,1
5.0,christina,2024-04-27,grandpa love nice projector,nice projector grandpa birthday gift happy purchase love stay home watch movie friendly user easy use set tv either use wifi bluetooth another like love go camp bring lightweighted small picture quality good tv thank much product arrive time able give weekend bday party,electronics,5.0,5.0,"['nice', 'projector', 'grandpa', 'birthday', 'gift', 'happy', 'purchase', 'love', 'stay', 'home', 'watch', 'movie', 'friendly', 'user', 'easy', 'use', 'set', 'tv', 'either', 'use', 'wifi', 'bluetooth', 'another', 'like', 'love', 'go', 'camp', 'bring', 'lightweighted', 'small', 'picture', 'quality', 'good', 'tv', 'thank', 'much', 'product', 'arrive', 'time', 'able', 'give', 'weekend', 'bday', 'party']",1,1
5.0,michelle,2024-11-26,amaze portable projector,buy around 50 black friday want affordable beginnerfriendly projector project bedroom ceiling take outside deck company havent try take outside project perfectly onto ceiling bluetooth capable use shokz headphones sound audio decent prefer connect another device sound better,electronics,4.0,5.0,"['buy', 'around', '50', 'black', 'friday', 'want', 'affordable', 'beginnerfriendly', 'projector', 'project', 'bedroom', 'ceiling', 'take', 'outside', 'deck', 'company', 'havent', 'try', 'take', 'outside', 'project', 'perfectly', 'onto', 'ceiling', 'bluetooth', 'capable', 'use', 'shokz', 'headphones', 'sound', 'audio', 'decent', 'prefer', 'connect', 'another', 'device', 'sound', 'better']",1,1
4.0,natalie,2025-04-14,good image work,really surprise quality image price size sound quality not amaze doesnt mean bad normal since design share video app work fine image although not perfect good enough see color main concern buy remind quality cheap tvs begin 2000s lol good enough extra secondary tv need case,electronics,3.0,4.0,"['really', 'surprise', 'quality', 'image', 'price', 'size', 'sound', 'quality', 'not', 'amaze', 'doesnt', 'mean', 'bad', 'normal', 'since', 'design', 'share', 'video', 'app', 'work', 'fine', 'image', 'although', 'not', 'perfect', 'good', 'enough', 'see', 'color', 'main', 'concern', 'buy', 'remind', 'quality', 'cheap', 'tvs', 'begin', '2000s', 'lol', 'good', 'enough', 'extra', 'secondary', 'tv', 'need', 'case']",1,1
4.0,anonymous,2025-07-12,impress,good projector price would recommend still use firestick roku applications software projector little glitchy definitely worth money though,electronics,4.0,5.0,"['good', 'projector', 'price', 'would', 'recommend', 'still', 'use', 'firestick', 'roku', 'applications', 'software', 'projector', 'little', 'glitchy', 'definitely', 'worth', 'money', 'though']",1,1
3.0,paul,2025-05-28,meh suckered review not,buy base article pop say 400 projector practically free lot lately bite figure 58 buck lose well wont airplay wont stream tube tv play file dim almost like bad drive basic android tv functionality not much simple yet kinda worthless not really worth ez operate focus thats worth unless totally dark room best option something else,electronics,2.0,1.0,"['buy', 'base', 'article', 'pop', 'say', '400', 'projector', 'practically', 'free', 'lot', 'lately', 'bite', 'figure', '58', 'buck', 'lose', 'well', 'wont', 'airplay', 'wont', 'stream', 'tube', 'tv', 'play', 'file', 'dim', 'almost', 'like', 'bad', 'drive', 'basic', 'android', 'tv', 'functionality', 'not', 'much', 'simple', 'yet', 'kinda', 'worthless', 'not', 'really', 'worth', 'ez', 'operate', 'focus', 'thats', 'worth', 'unless', 'totally', 'dark', 'room', 'best', 'option', 'something', 'else']",1,1
3.0,argenis,2025-01-31,get pay,make purchase base review clearly not worth 400 worth pay picture quality okay keystone feature work well soon adjust auto focus within milliseconds no brightness control time scenes youre watch look dark get 120 able adjust manual focus give clear picture things get blurry dont recommend use audio no good bluetooth speaker trick give context cell phone may sound better movie android play store good apps 26 game netflix cert,electronics,1.0,2.0,"['make', 'purchase', 'base', 'review', 'clearly', 'not', 'worth', '400', 'worth', 'pay', 'picture', 'quality', 'okay', 'keystone', 'feature', 'work', 'well', 'soon', 'adjust', 'auto', 'focus', 'within', 'milliseconds', 'no', 'brightness', 'control', 'time', 'scenes', 'youre', 'watch', 'look', 'dark', 'get', '120', 'able', 'adjust', 'manual', 'focus', 'give', 'clear', 'picture', 'things', 'get', 'blurry', 'dont', 'recommend', 'use', 'audio', 'no', 'good', 'bluetooth', 'speaker', 'trick', 'give', 'context', 'cell', 'phone', 'may', 'sound', 'better', 'movie', 'android', 'play', 'store', 'good', 'apps', '26', 'game', 'netflix', 'cert']",0,1
2.0,sharon,2025-01-30,go return,two star wifi bluetooth high resolution product not compatible airplay reach company tell use cable another thing project black spot definitely something wrong,electronics,1.0,2.0,"['two', 'star', 'wifi', 'bluetooth', 'high', 'resolution', 'product', 'not', 'compatible', 'airplay', 'reach', 'company', 'tell', 'use', 'cable', 'another', 'thing', 'project', 'black', 'spot', 'definitely', 'something', 'wrong']",1,0
3.0,jason,2025-05-06,not 4k,picture look good thing think gonna 4k not main reason buy,electronics,1.0,4.0,"['picture', 'look', 'good', 'thing', 'think', 'gonna', '4k', 'not', 'main', 'reason', 'buy']",1,1
5.0,luisa,2025-02-09,worth money,worth money spend connect apple tv work perfectly issue dont unplug turn back sound doesnt work overall product pretty good,electronics,3.0,5.0,"['worth', 'money', 'spend', 'connect', 'apple', 'tv', 'work', 'perfectly', 'issue', 'dont', 'unplug', 'turn', 'back', 'sound', 'doesnt', 'work', 'overall', 'product', 'pretty', 'good']",1,1
1.0,elfonsey,2024-12-05,false advertise,not item order evidence see attach picture recieved order picture would like item order money back make no difference,electronics,2.0,1.0,"['not', 'item', 'order', 'evidence', 'see', 'attach', 'picture', 'recieved', 'order', 'picture', 'would', 'like', 'item', 'order', 'money', 'back', 'make', 'no', 'difference']",0,1
4.0,christina,2025-02-12,cant scroll netflix easily,really like things dont like not able scroll netflix easilyyou use mouse button fact not chargeableit plug work,electronics,1.0,3.0,"['really', 'like', 'things', 'dont', 'like', 'not', 'able', 'scroll', 'netflix', 'easilyyou', 'use', 'mouse', 'button', 'fact', 'not', 'chargeableit', 'plug', 'work']",1,1
5.0,becky1968,2025-08-31,good pic,great pic easy use love pic back neighbor wood fence fire go,electronics,5.0,5.0,"['great', 'pic', 'easy', 'use', 'love', 'pic', 'back', 'neighbor', 'wood', 'fence', 'fire', 'go']",1,1
5.0,aaliyah,2025-09-29,,projector absolutely amaze surprise price sound good picture quality super clearjust plug connect wifi worksss good come hdmi hook computer anything else,electronics,5.0,5.0,"['projector', 'absolutely', 'amaze', 'surprise', 'price', 'sound', 'good', 'picture', 'quality', 'super', 'clearjust', 'plug', 'connect', 'wifi', 'worksss', 'good', 'come', 'hdmi', 'hook', 'computer', 'anything', 'else']",1,1
5.0,angel,2024-04-23,worth buy,small size big effect plug play see comment try buy mentality not expect clear no difference tv convenient tv not hang wall put wall big screen tv also cast ceiling achieve lie enjoy program hundreds dollars see draw curtain day also clear slightly less night overall cost performance high real comment buyers behind real reference,electronics,5.0,5.0,"['small', 'size', 'big', 'effect', 'plug', 'play', 'see', 'comment', 'try', 'buy', 'mentality', 'not', 'expect', 'clear', 'no', 'difference', 'tv', 'convenient', 'tv', 'not', 'hang', 'wall', 'put', 'wall', 'big', 'screen', 'tv', 'also', 'cast', 'ceiling', 'achieve', 'lie', 'enjoy', 'program', 'hundreds', 'dollars', 'see', 'draw', 'curtain', 'day', 'also', 'clear', 'slightly', 'less', 'night', 'overall', 'cost', 'performance', 'high', 'real', 'comment', 'buyers', 'behind', 'real', 'reference']",0,1
5.0,bishal,2024-05-02,good small projector,projector arrive time good package projector light weight compact portable like visual resolution high definition clear clarity visuals projector connect internet use wifi speakers use bluetooth like sound speaker connect use bluetooth good small projector,electronics,4.0,5.0,"['projector', 'arrive', 'time', 'good', 'package', 'projector', 'light', 'weight', 'compact', 'portable', 'like', 'visual', 'resolution', 'high', 'definition', 'clear', 'clarity', 'visuals', 'projector', 'connect', 'internet', 'use', 'wifi', 'speakers', 'use', 'bluetooth', 'like', 'sound', 'speaker', 'connect', 'use', 'bluetooth', 'good', 'small', 'projector']",1,1
5.0,min,2024-05-08,good product,buy projector family room quality amaze everyone love projector easy use not much clean movie night doughters birthday freinds ask products afterwards downside audio little lower use bluetooth speaker fine overall family love lot,electronics,5.0,5.0,"['buy', 'projector', 'family', 'room', 'quality', 'amaze', 'everyone', 'love', 'projector', 'easy', 'use', 'not', 'much', 'clean', 'movie', 'night', 'doughters', 'birthday', 'freinds', 'ask', 'products', 'afterwards', 'downside', 'audio', 'little', 'lower', 'use', 'bluetooth', 'speaker', 'fine', 'overall', 'family', 'love', 'lot']",1,1
