rating,reviewer_id,date,review_title,review_body,category,score_gemini,score_groq,tokens,bing_prediction,swn_prediction
5.0,ns,2024-05-01,nice projector high picture quality,really like product compact nice design easy move install like pixels quality projector really help baby calm also enjoy watch movies projector connect wifi enjoy netflix youtube convenient move room anywhere without issue far happy purchase,electronics,5.0,5.0,"['really', 'like', 'product', 'compact', 'nice', 'design', 'easy', 'move', 'install', 'like', 'pixels', 'quality', 'projector', 'really', 'help', 'baby', 'calm', 'also', 'enjoy', 'watch', 'movies', 'projector', 'connect', 'wifi', 'enjoy', 'netflix', 'youtube', 'convenient', 'move', 'room', 'anywhere', 'without', 'issue', 'far', 'happy', 'purchase']",1,1
5.0,ss,2024-05-04,smart compact projector 4k,smart compact 4k projector like especially price range work well actually beyond expectations price think would not work wifi watch prime netflix youtube need not stick tv time move room want watch anything easy set worth buy,electronics,4.0,5.0,"['smart', 'compact', '4k', 'projector', 'like', 'especially', 'price', 'range', 'work', 'well', 'actually', 'beyond', 'expectations', 'price', 'think', 'would', 'not', 'work', 'wifi', 'watch', 'prime', 'netflix', 'youtube', 'need', 'not', 'stick', 'tv', 'time', 'move', 'room', 'want', 'watch', 'anything', 'easy', 'set', 'worth', 'buy']",1,1
5.0,calvin,2024-06-19,good compact projector,get mini projector smart movie projection recently awesome super easy set use picture quality pretty impressive small device lightweight portable ive move around house even use outdoor movie night one cool thing try project onto ceiling lie bedsuch fun experience check photo builtin speakers decent overall great little projector price,electronics,4.0,5.0,"['get', 'mini', 'projector', 'smart', 'movie', 'projection', 'recently', 'awesome', 'super', 'easy', 'set', 'use', 'picture', 'quality', 'pretty', 'impressive', 'small', 'device', 'lightweight', 'portable', 'ive', 'move', 'around', 'house', 'even', 'use', 'outdoor', 'movie', 'night', 'one', 'cool', 'thing', 'try', 'project', 'onto', 'ceiling', 'lie', 'bedsuch', 'fun', 'experience', 'check', 'photo', 'builtin', 'speakers', 'decent', 'overall', 'great', 'little', 'projector', 'price']",1,1
5.0,nikita,2024-05-06,simply great projector worth buy,simply amaze product well perform like product easy install take 5 minutes open operate work wifi price affordable enjoy watch show projector easy move setup room also carry want trip,electronics,5.0,5.0,"['simply', 'amaze', 'product', 'well', 'perform', 'like', 'product', 'easy', 'install', 'take', '5', 'minutes', 'open', 'operate', 'work', 'wifi', 'price', 'affordable', 'enjoy', 'watch', 'show', 'projector', 'easy', 'move', 'setup', 'room', 'also', 'carry', 'want', 'trip']",1,1
5.0,jona,2024-04-27,surprisingly good projector,take almost no time set simple small portable test floor verify important stuff work take mount base screw ceiling single screw washer instal work great im surprise quality image clear autokeystone function straighten image instantly wifi android os remote controller fine standalone entertainment projector not try cast nor usb hdmi function stream fast smooth minor complaint brightness image definitely not bright enough use well light room work well dim room great dark sound quality good not loud crystal clear besides thats bluetooth overall good easy use projector,electronics,5.0,4.0,"['take', 'almost', 'no', 'time', 'set', 'simple', 'small', 'portable', 'test', 'floor', 'verify', 'important', 'stuff', 'work', 'take', 'mount', 'base', 'screw', 'ceiling', 'single', 'screw', 'washer', 'instal', 'work', 'great', 'im', 'surprise', 'quality', 'image', 'clear', 'autokeystone', 'function', 'straighten', 'image', 'instantly', 'wifi', 'android', 'os', 'remote', 'controller', 'fine', 'standalone', 'entertainment', 'projector', 'not', 'try', 'cast', 'nor', 'usb', 'hdmi', 'function', 'stream', 'fast', 'smooth', 'minor', 'complaint', 'brightness', 'image', 'definitely', 'not', 'bright', 'enough', 'use', 'well', 'light', 'room', 'work', 'well', 'dim', 'room', 'great', 'dark', 'sound', 'quality', 'good', 'not', 'loud', 'crystal', 'clear', 'besides', 'thats', 'bluetooth', 'overall', 'good', 'easy', 'use', 'projector']",0,1
3.0,asia,2025-03-16,absolutely love im disappoint,love much absolutely amaze problem iphone unable connect phone option available miracast android spend 20 buy miracast phone app free service not able mirror phone big part order im disappoint also saw sell cheaper tiktok screenplay option iphone like say love serve purpose definitely wont buy tvs anymore product great im hurt not able connect phone,electronics,5.0,1.0,"['love', 'much', 'absolutely', 'amaze', 'problem', 'iphone', 'unable', 'connect', 'phone', 'option', 'available', 'miracast', 'android', 'spend', '20', 'buy', 'miracast', 'phone', 'app', 'free', 'service', 'not', 'able', 'mirror', 'phone', 'big', 'part', 'order', 'im', 'disappoint', 'also', 'saw', 'sell', 'cheaper', 'tiktok', 'screenplay', 'option', 'iphone', 'like', 'say', 'love', 'serve', 'purpose', 'definitely', 'wont', 'buy', 'tvs', 'anymore', 'product', 'great', 'im', 'hurt', 'not', 'able', 'connect', 'phone']",1,1
2.0,stephen,2024-10-31,could better,picture quality good auto adjust doesnt work well cant get apps work youtube without add chromcast roku,electronics,2.0,3.0,"['picture', 'quality', 'good', 'auto', 'adjust', 'doesnt', 'work', 'well', 'cant', 'get', 'apps', 'work', 'youtube', 'without', 'add', 'chromcast', 'roku']",1,1
5.0,bedy,2024-09-27,life saver,pocket projector nice image good resolution nice screen view size use seal girlfriend watch tv 1080p 60hz good game 4k 30hz decent game 1080p 60hz good video stream 4k 30hz decent video stream,electronics,5.0,5.0,"['pocket', 'projector', 'nice', 'image', 'good', 'resolution', 'nice', 'screen', 'view', 'size', 'use', 'seal', 'girlfriend', 'watch', 'tv', '1080p', '60hz', 'good', 'game', '4k', '30hz', 'decent', 'game', '1080p', '60hz', 'good', 'video', 'stream', '4k', '30hz', 'decent', 'video', 'stream']",1,1
5.0,sid,2024-06-15,smart great quality,honestly super surprise quality projector apps like netflix youtube already come instal also cast phone directly projector love quality totally worth price,electronics,5.0,5.0,"['honestly', 'super', 'surprise', 'quality', 'projector', 'apps', 'like', 'netflix', 'youtube', 'already', 'come', 'instal', 'also', 'cast', 'phone', 'directly', 'projector', 'love', 'quality', 'totally', 'worth', 'price']",1,1
5.0,anna,2024-04-24,compact portable projector,light small projector relatively clear even daytime think use not home also campingthe builtin app also fast open,electronics,4.0,5.0,"['light', 'small', 'projector', 'relatively', 'clear', 'even', 'daytime', 'think', 'use', 'not', 'home', 'also', 'campingthe', 'builtin', 'app', 'also', 'fast', 'open']",0,1
5.0,rachel,2024-10-23,well worth happy find sale,amaze easy set hook wifi picture crisp clear sound good add sound bar better sound farther away unit,electronics,5.0,5.0,"['amaze', 'easy', 'set', 'hook', 'wifi', 'picture', 'crisp', 'clear', 'sound', 'good', 'add', 'sound', 'bar', 'better', 'sound', 'farther', 'away', 'unit']",1,1
5.0,jam,2025-10-30,,buy camp watch scary movies outdoors absolutely love small portable convenient simple plug n play smart projector hdmi bluetooth smart apps preloaded perfect hi def picture amaze sound little projector tho bluetooth external speaker movies outside perfect around,electronics,5.0,5.0,"['buy', 'camp', 'watch', 'scary', 'movies', 'outdoors', 'absolutely', 'love', 'small', 'portable', 'convenient', 'simple', 'plug', 'n', 'play', 'smart', 'projector', 'hdmi', 'bluetooth', 'smart', 'apps', 'preloaded', 'perfect', 'hi', 'def', 'picture', 'amaze', 'sound', 'little', 'projector', 'tho', 'bluetooth', 'external', 'speaker', 'movies', 'outside', 'perfect', 'around']",1,1
5.0,carlos,2025-10-31,,im impress little portable projector easy use small speaker inside bluetooth speaker make sound better easily sync smartphone apps already install apps portable cant wait take beach camp even use balcony,electronics,5.0,5.0,"['im', 'impress', 'little', 'portable', 'projector', 'easy', 'use', 'small', 'speaker', 'inside', 'bluetooth', 'speaker', 'make', 'sound', 'better', 'easily', 'sync', 'smartphone', 'apps', 'already', 'install', 'apps', 'portable', 'cant', 'wait', 'take', 'beach', 'camp', 'even', 'use', 'balcony']",1,1
4.0,jane,2025-11-20,,work great bluetooth ipad android phone wifi stream service would better resolution color intensity good screen find wall ceiling quite good artist project image canvas sketch wonderful great value doesnt heat 30 minutes use happy,electronics,5.0,5.0,"['work', 'great', 'bluetooth', 'ipad', 'android', 'phone', 'wifi', 'stream', 'service', 'would', 'better', 'resolution', 'color', 'intensity', 'good', 'screen', 'find', 'wall', 'ceiling', 'quite', 'good', 'artist', 'project', 'image', 'canvas', 'sketch', 'wonderful', 'great', 'value', 'doesnt', 'heat', '30', 'minutes', 'use', 'happy']",1,1
1.0,julie,2026-01-07,,finally get projector setup turn discover lens dirty inside dirt spot show middle screen everything try watch make us miss fine detail like watch bad vhs tape thats not bad enough projector constantly shut random moments throughout movie tech support recommend unplug projector fix problem not correct problem,electronics,3.0,5.0,"['finally', 'get', 'projector', 'setup', 'turn', 'discover', 'lens', 'dirty', 'inside', 'dirt', 'spot', 'show', 'middle', 'screen', 'everything', 'try', 'watch', 'make', 'us', 'miss', 'fine', 'detail', 'like', 'watch', 'bad', 'vhs', 'tape', 'thats', 'not', 'bad', 'enough', 'projector', 'constantly', 'shut', 'random', 'moments', 'throughout', 'movie', 'tech', 'support', 'recommend', 'unplug', 'projector', 'fix', 'problem', 'not', 'correct', 'problem']",1,0
2.0,robert,2025-11-30,deceptive market 40 product,40 projector not 300 projector drastically reduce shameful market worth pay hope walmart aware use deceptive market practice want return lie not feel rip,electronics,1.0,1.0,"['40', 'projector', 'not', '300', 'projector', 'drastically', 'reduce', 'shameful', 'market', 'worth', 'pay', 'hope', 'walmart', 'aware', 'use', 'deceptive', 'market', 'practice', 'want', 'return', 'lie', 'not', 'feel', 'rip']",0,1
5.0,dee,2025-12-28,great little projector,purchase projector see version social media honestly blow away picture quality build android system also use google stick roku device find easier use add devices remote control thats personal preference sound quality could better use earbuds meet expectations pair bluetooth speaker better volume great little projector price extremely convenient,electronics,1.0,5.0,"['purchase', 'projector', 'see', 'version', 'social', 'media', 'honestly', 'blow', 'away', 'picture', 'quality', 'build', 'android', 'system', 'also', 'use', 'google', 'stick', 'roku', 'device', 'find', 'easier', 'use', 'add', 'devices', 'remote', 'control', 'thats', 'personal', 'preference', 'sound', 'quality', 'could', 'better', 'use', 'earbuds', 'meet', 'expectations', 'pair', 'bluetooth', 'speaker', 'better', 'volume', 'great', 'little', 'projector', 'price', 'extremely', 'convenient']",1,1
1.0,gysbert,2025-12-27,total crap,piece dung cheap pakistan product walmart try sell us not buy picture quality low struggle connect wifi struggle clear picture no proper focus not stay connect wifi bluetooth phone,electronics,1.0,1.0,"['piece', 'dung', 'cheap', 'pakistan', 'product', 'walmart', 'try', 'sell', 'us', 'not', 'buy', 'picture', 'quality', 'low', 'struggle', 'connect', 'wifi', 'struggle', 'clear', 'picture', 'no', 'proper', 'focus', 'not', 'stay', 'connect', 'wifi', 'bluetooth', 'phone']",1,1
1.0,jacob,2025-11-21,youre want quality projector look elsewhere,qc must miss one several small object interior lens appear kind oil grease leave nice smudge corner im busy guy not worth time return one step ewaste since technically operational,electronics,2.0,1.0,"['qc', 'must', 'miss', 'one', 'several', 'small', 'object', 'interior', 'lens', 'appear', 'kind', 'oil', 'grease', 'leave', 'nice', 'smudge', 'corner', 'im', 'busy', 'guy', 'not', 'worth', 'time', 'return', 'one', 'step', 'ewaste', 'since', 'technically', 'operational']",0,1
1.0,timothy,2025-11-27,,mislead original price walmart say originally 399 white one 299 black one reality originally 99 put sale say consumer save actually everyone already know literally anything buy walmart inferior original product walmart roll back price blatant lie unacceptable happily purchase higher price one return one know ill actually get im pay not mislead,electronics,1.0,1.0,"['mislead', 'original', 'price', 'walmart', 'say', 'originally', '399', 'white', 'one', '299', 'black', 'one', 'reality', 'originally', '99', 'put', 'sale', 'say', 'consumer', 'save', 'actually', 'everyone', 'already', 'know', 'literally', 'anything', 'buy', 'walmart', 'inferior', 'original', 'product', 'walmart', 'roll', 'back', 'price', 'blatant', 'lie', 'unacceptable', 'happily', 'purchase', 'higher', 'price', 'one', 'return', 'one', 'know', 'ill', 'actually', 'get', 'im', 'pay', 'not', 'mislead']",0,0
1.0,astrid,2025-11-21,,product arrive thursday open box turn complete setup follow instructions shut unplug notice device unusually hot hour later try use fail load options menu display content simply wouldnt start properly malfunction im request refund,electronics,1.0,1.0,"['product', 'arrive', 'thursday', 'open', 'box', 'turn', 'complete', 'setup', 'follow', 'instructions', 'shut', 'unplug', 'notice', 'device', 'unusually', 'hot', 'hour', 'later', 'try', 'use', 'fail', 'load', 'options', 'menu', 'display', 'content', 'simply', 'wouldnt', 'start', 'properly', 'malfunction', 'im', 'request', 'refund']",0,0
5.0,miranda,2026-01-01,,perfect item outdoor movie nights move use closet entertain daughter move furniture house super easy use overall great purchase cant wait summer fire pit season entertain kid,electronics,1.0,5.0,"['perfect', 'item', 'outdoor', 'movie', 'nights', 'move', 'use', 'closet', 'entertain', 'daughter', 'move', 'furniture', 'house', 'super', 'easy', 'use', 'overall', 'great', 'purchase', 'cant', 'wait', 'summer', 'fire', 'pit', 'season', 'entertain', 'kid']",1,1
3.0,danny,2025-11-24,,love price compact ease use find operate hoe limit place tirned heat produce like blow dryer screen wouldnt level function easy navigaye picturr quslity wasnt clear hop read double read instructions gibmve 3 star heat blow scary safetyhazzars thays think experience,electronics,5.0,3.0,"['love', 'price', 'compact', 'ease', 'use', 'find', 'operate', 'hoe', 'limit', 'place', 'tirned', 'heat', 'produce', 'like', 'blow', 'dryer', 'screen', 'wouldnt', 'level', 'function', 'easy', 'navigaye', 'picturr', 'quslity', 'wasnt', 'clear', 'hop', 'read', 'double', 'read', 'instructions', 'gibmve', '3', 'star', 'heat', 'blow', 'scary', 'safetyhazzars', 'thays', 'think', 'experience']",1,1
4.0,michael,2025-11-12,christmas gift drive home backyard,buy gift christmas look like nice projector dont want open christmas gift money look like great deal also buy portable screen sound bar like movie night every saturday night know kid love size look like drive,electronics,1.0,5.0,"['buy', 'gift', 'christmas', 'look', 'like', 'nice', 'projector', 'dont', 'want', 'open', 'christmas', 'gift', 'money', 'look', 'like', 'great', 'deal', 'also', 'buy', 'portable', 'screen', 'sound', 'bar', 'like', 'movie', 'night', 'every', 'saturday', 'night', 'know', 'kid', 'love', 'size', 'look', 'like', 'drive']",1,1
4.0,jason,2025-12-15,,work exceptionally well price feature something spend hundreds dollars even thousand thing feature good im sure good others need something inexpensive thats get good quality multiple feature,electronics,3.0,5.0,"['work', 'exceptionally', 'well', 'price', 'feature', 'something', 'spend', 'hundreds', 'dollars', 'even', 'thousand', 'thing', 'feature', 'good', 'im', 'sure', 'good', 'others', 'need', 'something', 'inexpensive', 'thats', 'get', 'good', 'quality', 'multiple', 'feature']",1,1
5.0,kim,2025-12-25,work well,son move apartment right christmas know like tv bedroom figure would want one live room well much cheaper solution love project right fireplace tv mount picture great really surprise well perform extremely happy,electronics,4.0,4.0,"['son', 'move', 'apartment', 'right', 'christmas', 'know', 'like', 'tv', 'bedroom', 'figure', 'would', 'want', 'one', 'live', 'room', 'well', 'much', 'cheaper', 'solution', 'love', 'project', 'right', 'fireplace', 'tv', 'mount', 'picture', 'great', 'really', 'surprise', 'well', 'perform', 'extremely', 'happy']",1,1
1.0,lhohio,2025-12-26,,fraud didnt order return code send refund recharge contest card co lie n say order 2 return one despite provide proof send one still wouldnt help cant get anyone figure ot scammed note didnt even purchase item order middle night n no one else,electronics,5.0,1.0,"['fraud', 'didnt', 'order', 'return', 'code', 'send', 'refund', 'recharge', 'contest', 'card', 'co', 'lie', 'n', 'say', 'order', '2', 'return', 'one', 'despite', 'provide', 'proof', 'send', 'one', 'still', 'wouldnt', 'help', 'cant', 'get', 'anyone', 'figure', 'ot', 'scammed', 'note', 'didnt', 'even', 'purchase', 'item', 'order', 'middle', 'night', 'n', 'no', 'one', 'else']",0,0
4.0,riley,2026-01-05,good slight issue,alright not best one need use xbox picture good change picture settings settings extreme like brightness get way bright even put couple notch change sharpness barely look like things outline sharpie remote work well doesnt make lot noise volume low even way might need bluetooth speaker,electronics,1.0,3.0,"['alright', 'not', 'best', 'one', 'need', 'use', 'xbox', 'picture', 'good', 'change', 'picture', 'settings', 'settings', 'extreme', 'like', 'brightness', 'get', 'way', 'bright', 'even', 'put', 'couple', 'notch', 'change', 'sharpness', 'barely', 'look', 'like', 'things', 'outline', 'sharpie', 'remote', 'work', 'well', 'doesnt', 'make', 'lot', 'noise', 'volume', 'low', 'even', 'way', 'might', 'need', 'bluetooth', 'speaker']",1,1
2.0,keren,2026-01-05,ok price sale,picture not great look really pixelated even adjust settings not bright bluetooth work fine also doesnt seem work hdmi work include hdmi reason include one plus,electronics,2.0,2.0,"['picture', 'not', 'great', 'look', 'really', 'pixelated', 'even', 'adjust', 'settings', 'not', 'bright', 'bluetooth', 'work', 'fine', 'also', 'doesnt', 'seem', 'work', 'hdmi', 'work', 'include', 'hdmi', 'reason', 'include', 'one', 'plus']",0,1
3.0,michael,2025-11-27,cheap work not ideal solution,light dim almost completely black room get good picture quality image far cry hd blurry pixelated setup usage super easy thats upside pay 49 since sale price guess get pay would not recommend hindsight might better 100200 range get higherquality projector,electronics,1.0,2.0,"['light', 'dim', 'almost', 'completely', 'black', 'room', 'get', 'good', 'picture', 'quality', 'image', 'far', 'cry', 'hd', 'blurry', 'pixelated', 'setup', 'usage', 'super', 'easy', 'thats', 'upside', 'pay', '49', 'since', 'sale', 'price', 'guess', 'get', 'pay', 'would', 'not', 'recommend', 'hindsight', 'might', 'better', '100200', 'range', 'get', 'higherquality', 'projector']",1,1
5.0,john,2025-11-03,,amaze little projector low price skeptical figure worth risk well surprise unit easily rival much costly projector setup super easy picture surprisingly good absolutely no lag time,electronics,1.0,5.0,"['amaze', 'little', 'projector', 'low', 'price', 'skeptical', 'figure', 'worth', 'risk', 'well', 'surprise', 'unit', 'easily', 'rival', 'much', 'costly', 'projector', 'setup', 'super', 'easy', 'picture', 'surprisingly', 'good', 'absolutely', 'no', 'lag', 'time']",1,1
3.0,andrew,2025-11-18,100 honest review,good thing projector easy set plug play say would not recommend anyones main view device house hold make flimsy plastic weigh less soda power cable 3 feet long really work plug back device limit room rotate stand operate system device run look really sketchy like say google play store would rather use firestick risk get account hack log device manage buy sale 40 honestly not even worth much want something thats portable mabe want use fun gimmick kid room would better dont see last year,electronics,1.0,1.0,"['good', 'thing', 'projector', 'easy', 'set', 'plug', 'play', 'say', 'would', 'not', 'recommend', 'anyones', 'main', 'view', 'device', 'house', 'hold', 'make', 'flimsy', 'plastic', 'weigh', 'less', 'soda', 'power', 'cable', '3', 'feet', 'long', 'really', 'work', 'plug', 'back', 'device', 'limit', 'room', 'rotate', 'stand', 'operate', 'system', 'device', 'run', 'look', 'really', 'sketchy', 'like', 'say', 'google', 'play', 'store', 'would', 'rather', 'use', 'firestick', 'risk', 'get', 'account', 'hack', 'log', 'device', 'manage', 'buy', 'sale', '40', 'honestly', 'not', 'even', 'worth', 'much', 'want', 'something', 'thats', 'portable', 'mabe', 'want', 'use', 'fun', 'gimmick', 'kid', 'room', 'would', 'better', 'dont', 'see', 'last', 'year']",1,1
3.0,jaime,2025-11-25,slightly disappoint,projector compact easy set quality picture not good room need pitch black brightness level poor dont think ill able use outdoors unless dark projector may good fit holiday decor use project image holiday image windows movie use not great might better pay bite better quality projector,electronics,5.0,3.0,"['projector', 'compact', 'easy', 'set', 'quality', 'picture', 'not', 'good', 'room', 'need', 'pitch', 'black', 'brightness', 'level', 'poor', 'dont', 'think', 'ill', 'able', 'use', 'outdoors', 'unless', 'dark', 'projector', 'may', 'good', 'fit', 'holiday', 'decor', 'use', 'project', 'image', 'holiday', 'image', 'windows', 'movie', 'use', 'not', 'great', 'might', 'better', 'pay', 'bite', 'better', 'quality', 'projector']",0,1
5.0,aly,2025-11-30,love,love much favorite thing ive order giant tv roof im bed video quality great call mom show like want one dad come home saw guess say want one get,electronics,1.0,4.0,"['love', 'much', 'favorite', 'thing', 'ive', 'order', 'giant', 'tv', 'roof', 'im', 'bed', 'video', 'quality', 'great', 'call', 'mom', 'show', 'like', 'want', 'one', 'dad', 'come', 'home', 'saw', 'guess', 'say', 'want', 'one', 'get']",1,1
3.0,walmart customer,2025-12-24,good price not picky,dark room projector look good brightness isnt enough watch outside twilight day build speakers work pinch audio image sync connect bluetooth speaker price good product use dark room ok lip audio sync,electronics,2.0,5.0,"['dark', 'room', 'projector', 'look', 'good', 'brightness', 'isnt', 'enough', 'watch', 'outside', 'twilight', 'day', 'build', 'speakers', 'work', 'pinch', 'audio', 'image', 'sync', 'connect', 'bluetooth', 'speaker', 'price', 'good', 'product', 'use', 'dark', 'room', 'ok', 'lip', 'audio', 'sync']",1,1
5.0,katherine,2025-12-22,,admit wasnt expect work well im impress definitely get moneys worth bluetooth connection quick connect wifi easily auto adjust work well make sure room youre use good dark pretty much plug play easy enough set,electronics,4.0,5.0,"['admit', 'wasnt', 'expect', 'work', 'well', 'im', 'impress', 'definitely', 'get', 'moneys', 'worth', 'bluetooth', 'connection', 'quick', 'connect', 'wifi', 'easily', 'auto', 'adjust', 'work', 'well', 'make', 'sure', 'room', 'youre', 'use', 'good', 'dark', 'pretty', 'much', 'plug', 'play', 'easy', 'enough', 'set']",1,1
3.0,maurice,2025-12-22,decent short burst not long term use,plus auto adjust great decent brightness good background access google store negative couldnt get access screen mirror finicky could not get stay focus work full phone minus yet see last 15 hours no action game delay no good hour start stutter 30 minutes later freeze need unplug remote cheaply make not often audio delay,electronics,2.0,2.0,"['plus', 'auto', 'adjust', 'great', 'decent', 'brightness', 'good', 'background', 'access', 'google', 'store', 'negative', 'couldnt', 'get', 'access', 'screen', 'mirror', 'finicky', 'could', 'not', 'get', 'stay', 'focus', 'work', 'full', 'phone', 'minus', 'yet', 'see', 'last', '15', 'hours', 'no', 'action', 'game', 'delay', 'no', 'good', 'hour', 'start', 'stutter', '30', 'minutes', 'later', 'freeze', 'need', 'unplug', 'remote', 'cheaply', 'make', 'not', 'often', 'audio', 'delay']",1,1
5.0,abhijeet,2025-12-05,amaze little inexpensive projector,native interface little clunky overall capabilities price point phenomenal connect apple tv great experience easily switch air pod external bluetooth speaker build speaker not great adequate use mobile projector great camp students may not room large screen,electronics,5.0,5.0,"['native', 'interface', 'little', 'clunky', 'overall', 'capabilities', 'price', 'point', 'phenomenal', 'connect', 'apple', 'tv', 'great', 'experience', 'easily', 'switch', 'air', 'pod', 'external', 'bluetooth', 'speaker', 'build', 'speaker', 'not', 'great', 'adequate', 'use', 'mobile', 'projector', 'great', 'camp', 'students', 'may', 'not', 'room', 'large', 'screen']",1,1
3.0,day,2025-09-29,picture good wifi work bluetooth doesnt,picture great quality advertise reason bluetooth wont connect phone speakers better surround sound build speaker work isnt loud connect wifi hotspots no problem wouldnt stream recommend view time 2 hours without 20 min rest due overheat overheat overall not bad price crazy mark,electronics,3.0,4.0,"['picture', 'great', 'quality', 'advertise', 'reason', 'bluetooth', 'wont', 'connect', 'phone', 'speakers', 'better', 'surround', 'sound', 'build', 'speaker', 'work', 'isnt', 'loud', 'connect', 'wifi', 'hotspots', 'no', 'problem', 'wouldnt', 'stream', 'recommend', 'view', 'time', '2', 'hours', 'without', '20', 'min', 'rest', 'due', 'overheat', 'overheat', 'overall', 'not', 'bad', 'price', 'crazy', 'mark']",1,1
