rating,reviewer_id,date,review_title,review_body,category,score_gemini,score_groq,tokens,bing_prediction,swn_prediction
1.0,jonathan,2025-11-28,,two mattresses uncomfortable return local store per specific email instructions walmartcom walmart refuse refund multiple call promise resolve multiple store visit no resolution store claim no way communicate anyone corporate higher level able reach call center incredibly frustrate unprofessional customer service experience not renew walmart membership shop walmart,furniture,1.0,1.0,"['two', 'mattresses', 'uncomfortable', 'return', 'local', 'store', 'per', 'specific', 'email', 'instructions', 'walmartcom', 'walmart', 'refuse', 'refund', 'multiple', 'call', 'promise', 'resolve', 'multiple', 'store', 'visit', 'no', 'resolution', 'store', 'claim', 'no', 'way', 'communicate', 'anyone', 'corporate', 'higher', 'level', 'able', 'reach', 'call', 'center', 'incredibly', 'frustrate', 'unprofessional', 'customer', 'service', 'experience', 'not', 'renew', 'walmart', 'membership', 'shop', 'walmart']",0,0
5.0,jazmin,2025-12-27,,maybe bc adults naturally heavier not like mattress get two kiddos not even 50 lbs theyre havent complain lay one felt hand almost rip thats thin felt,furniture,1.0,2.0,"['maybe', 'bc', 'adults', 'naturally', 'heavier', 'not', 'like', 'mattress', 'get', 'two', 'kiddos', 'not', 'even', '50', 'lbs', 'theyre', 'havent', 'complain', 'lay', 'one', 'felt', 'hand', 'almost', 'rip', 'thats', 'thin', 'felt']",0,1
5.0,andrea,2025-10-13,mattress,bed comfortable daughter love sleep lot better bed product definitely worth money reasonable price mattress comfortable opinion would recommend buy thisl bed comfortable daughter love sleep lot better bed product definitely worth money reasonable price mattress comfortable opinion would recommend buy im highly satisfy purchase im highly satisfy purchase,furniture,5.0,5.0,"['bed', 'comfortable', 'daughter', 'love', 'sleep', 'lot', 'better', 'bed', 'product', 'definitely', 'worth', 'money', 'reasonable', 'price', 'mattress', 'comfortable', 'opinion', 'would', 'recommend', 'buy', 'thisl', 'bed', 'comfortable', 'daughter', 'love', 'sleep', 'lot', 'better', 'bed', 'product', 'definitely', 'worth', 'money', 'reasonable', 'price', 'mattress', 'comfortable', 'opinion', 'would', 'recommend', 'buy', 'im', 'highly', 'satisfy', 'purchase', 'im', 'highly', 'satisfy', 'purchase']",1,1
1.0,anonymous,2025-08-19,mattress lack support,buy sons dorm mattress good price lack support back mattress sink soon sit im around 100 pound would like return request take store repack free pick not possible us repack mattress come tightly bundle roll spread full size open package stick one need think dispose,furniture,1.0,2.0,"['buy', 'sons', 'dorm', 'mattress', 'good', 'price', 'lack', 'support', 'back', 'mattress', 'sink', 'soon', 'sit', 'im', 'around', '100', 'pound', 'would', 'like', 'return', 'request', 'take', 'store', 'repack', 'free', 'pick', 'not', 'possible', 'us', 'repack', 'mattress', 'come', 'tightly', 'bundle', 'roll', 'spread', 'full', 'size', 'open', 'package', 'stick', 'one', 'need', 'think', 'dispose']",1,1
2.0,susan,2026-01-01,,mattress look nice picture disappoint real life look feel cheap uncomfortable definitely feel spring basically oversized crib mattress doesnt fully fit bed frame disappoint saw,furniture,1.0,1.0,"['mattress', 'look', 'nice', 'picture', 'disappoint', 'real', 'life', 'look', 'feel', 'cheap', 'uncomfortable', 'definitely', 'feel', 'spring', 'basically', 'oversized', 'crib', 'mattress', 'doesnt', 'fully', 'fit', 'bed', 'frame', 'disappoint', 'saw']",1,1
1.0,mary,2026-02-24,not satisfy purchase,mattress arrive roll box unpack let lay bed foundation 3 nights direct mattress completely collapes set not medfirm state not meet weight describe bad purchase make however sleep nothing else sleep therefore keep get another,furniture,2.0,1.0,"['mattress', 'arrive', 'roll', 'box', 'unpack', 'let', 'lay', 'bed', 'foundation', '3', 'nights', 'direct', 'mattress', 'completely', 'collapes', 'set', 'not', 'medfirm', 'state', 'not', 'meet', 'weight', 'describe', 'bad', 'purchase', 'make', 'however', 'sleep', 'nothing', 'else', 'sleep', 'therefore', 'keep', 'get', 'another']",1,0
5.0,scrapbookingvlcs,2026-03-04,twin firm 8 inch mattress,mattress come compress take 4872 hours decompress becareful open cartoon not damage mattress plump really nice say do nice firm gel pad material full nights sleep easy setup stand back say know kung fu hehehehe highly recommend,furniture,4.0,5.0,"['mattress', 'come', 'compress', 'take', '4872', 'hours', 'decompress', 'becareful', 'open', 'cartoon', 'not', 'damage', 'mattress', 'plump', 'really', 'nice', 'say', 'do', 'nice', 'firm', 'gel', 'pad', 'material', 'full', 'nights', 'sleep', 'easy', 'setup', 'stand', 'back', 'say', 'know', 'kung', 'fu', 'hehehehe', 'highly', 'recommend']",1,1
5.0,jade,2026-01-02,worth every penny,purchase mattress toddlers bunk bed 26 comfortable little nervous due review worth every penny super easy set take box 26 let lay flat take shape comfortable ive even sleep mattress mislead youre second guess purchase dont comfort 26 sturdiness good price,furniture,5.0,5.0,"['purchase', 'mattress', 'toddlers', 'bunk', 'bed', '26', 'comfortable', 'little', 'nervous', 'due', 'review', 'worth', 'every', 'penny', 'super', 'easy', 'set', 'take', 'box', '26', 'let', 'lay', 'flat', 'take', 'shape', 'comfortable', 'ive', 'even', 'sleep', 'mattress', 'mislead', 'youre', 'second', 'guess', 'purchase', 'dont', 'comfort', '26', 'sturdiness', 'good', 'price']",1,1
2.0,joan,2026-03-03,okay short term use,buy mattress 6month stay temporary address camp not intend keep mattress 6 months temporary mattress okay would not recommend ongoing use soft feel spring move sleep position,furniture,1.0,2.0,"['buy', 'mattress', '6month', 'stay', 'temporary', 'address', 'camp', 'not', 'intend', 'keep', 'mattress', '6', 'months', 'temporary', 'mattress', 'okay', 'would', 'not', 'recommend', 'ongoing', 'use', 'soft', 'feel', 'spring', 'move', 'sleep', 'position']",0,1
2.0,jenny,2026-03-06,mehh,get sons floor bed not sure im use sleep memory foam mattresses top layer thin feel every single spring fit bed frame perfectly like height toddler son sleep fine adult wouldnt get anyone 100lbs maybe separately topper would help,furniture,3.0,3.0,"['get', 'sons', 'floor', 'bed', 'not', 'sure', 'im', 'use', 'sleep', 'memory', 'foam', 'mattresses', 'top', 'layer', 'thin', 'feel', 'every', 'single', 'spring', 'fit', 'bed', 'frame', 'perfectly', 'like', 'height', 'toddler', 'son', 'sleep', 'fine', 'adult', 'wouldnt', 'get', 'anyone', '100lbs', 'maybe', 'separately', 'topper', 'would', 'help']",0,1
1.0,surbhi,2025-06-14,walmart refund nightmare,two months ago request refund walmart still havent receive customer service experience frustrate pass blame around despite call multiple time tell request wasnt escalate claim buyer beware walmarts refund process nightmare avoid order,furniture,2.0,1.0,"['two', 'months', 'ago', 'request', 'refund', 'walmart', 'still', 'havent', 'receive', 'customer', 'service', 'experience', 'frustrate', 'pass', 'blame', 'around', 'despite', 'call', 'multiple', 'time', 'tell', 'request', 'wasnt', 'escalate', 'claim', 'buyer', 'beware', 'walmarts', 'refund', 'process', 'nightmare', 'avoid', 'order']",0,0
3.0,dee,2025-06-19,need inexpensive mattress,inexpensive dont expect like high end mattress firm jiggly sleep partner movement shake movement shake get 8 inch mattress 4 inch foam topper also dont expect last 10 years might great guest room though,furniture,2.0,3.0,"['inexpensive', 'dont', 'expect', 'like', 'high', 'end', 'mattress', 'firm', 'jiggly', 'sleep', 'partner', 'movement', 'shake', 'movement', 'shake', 'get', '8', 'inch', 'mattress', '4', 'inch', 'foam', 'topper', 'also', 'dont', 'expect', 'last', '10', 'years', 'might', 'great', 'guest', 'room', 'though']",1,1
5.0,carrie,2025-06-27,good mattress,extremely comfortable ive sleep one 14 years get another day bed guest room come roll box vacuum pack cute warn card youre not careful open package explode go slow,furniture,1.0,1.0,"['extremely', 'comfortable', 'ive', 'sleep', 'one', '14', 'years', 'get', 'another', 'day', 'bed', 'guest', 'room', 'come', 'roll', 'box', 'vacuum', 'pack', 'cute', 'warn', 'card', 'youre', 'not', 'careful', 'open', 'package', 'explode', 'go', 'slow']",1,1
1.0,elias,2025-08-31,flatten quickly,take mattress box please within weeks flatten permanently center like one inch foam pad,furniture,4.0,1.0,"['take', 'mattress', 'box', 'please', 'within', 'weeks', 'flatten', 'permanently', 'center', 'like', 'one', 'inch', 'foam', 'pad']",1,1
1.0,hmandgprty4u,2025-09-13,,every movement felt inner spring buy mattresses topper know would purchase different one would not recommend mattress,furniture,1.0,1.0,"['every', 'movement', 'felt', 'inner', 'spring', 'buy', 'mattresses', 'topper', 'know', 'would', 'purchase', 'different', 'one', 'would', 'not', 'recommend', 'mattress']",0,1
3.0,anonymous,2025-10-13,,mattess differentif u get marker stain hard clean try clean marker stain baby cousin put bed leave yellow color stain bed wont go away,furniture,1.0,5.0,"['mattess', 'differentif', 'u', 'get', 'marker', 'stain', 'hard', 'clean', 'try', 'clean', 'marker', 'stain', 'baby', 'cousin', 'put', 'bed', 'leave', 'yellow', 'color', 'stain', 'bed', 'wont', 'go', 'away']",1,1
5.0,timothy,2025-07-21,,buy 2 kid product work great especially price buy 2 ruin im sure ill get good years first tho,furniture,1.0,2.0,"['buy', '2', 'kid', 'product', 'work', 'great', 'especially', 'price', 'buy', '2', 'ruin', 'im', 'sure', 'ill', 'get', 'good', 'years', 'first', 'tho']",1,1
1.0,ann,2025-11-22,,thin little support spring push right material seven year old lay minute instantly go flat complain poke,furniture,1.0,3.0,"['thin', 'little', 'support', 'spring', 'push', 'right', 'material', 'seven', 'year', 'old', 'lay', 'minute', 'instantly', 'go', 'flat', 'complain', 'poke']",0,0
5.0,charity,2025-09-13,nice,like size bigger think would nice fit little cousin roomshe say comfortable,furniture,1.0,5.0,"['like', 'size', 'bigger', 'think', 'would', 'nice', 'fit', 'little', 'cousin', 'roomshe', 'say', 'comfortable']",1,1
5.0,everie,2025-09-30,worth great 60 buy,not cheap flimsy great buy beautiful look comfortable temporary situation need twin size bed really help lower back feel great get back track not bad 60,furniture,1.0,5.0,"['not', 'cheap', 'flimsy', 'great', 'buy', 'beautiful', 'look', 'comfortable', 'temporary', 'situation', 'need', 'twin', 'size', 'bed', 'really', 'help', 'lower', 'back', 'feel', 'great', 'get', 'back', 'track', 'not', 'bad', '60']",1,1
5.0,stephanie,2025-11-02,,bed ready take box children like bunkbeds good value money elsewhere 15 20 plus ship free items bed box easy box heavy thou,furniture,1.0,3.0,"['bed', 'ready', 'take', 'box', 'children', 'like', 'bunkbeds', 'good', 'value', 'money', 'elsewhere', '15', '20', 'plus', 'ship', 'free', 'items', 'bed', 'box', 'easy', 'box', 'heavy', 'thou']",1,1
5.0,trudeau,2025-12-02,great mattress price,buy grandchildren new bunk bed grammy papas house love sleep well ready come back pop open box easily full size day,furniture,3.0,5.0,"['buy', 'grandchildren', 'new', 'bunk', 'bed', 'grammy', 'papas', 'house', 'love', 'sleep', 'well', 'ready', 'come', 'back', 'pop', 'open', 'box', 'easily', 'full', 'size', 'day']",1,1
3.0,joe,2026-02-06,thin good kid,fine mattress price thin good little kid youll need upgrade couple years quality good go thicker,furniture,3.0,4.0,"['fine', 'mattress', 'price', 'thin', 'good', 'little', 'kid', 'youll', 'need', 'upgrade', 'couple', 'years', 'quality', 'good', 'go', 'thicker']",1,1
3.0,anonymous,2025-08-11,uncomfortable,mattress feel dainty unsupportive son say feel inside bed probably buy matt topper comfortable use better,furniture,2.0,1.0,"['mattress', 'feel', 'dainty', 'unsupportive', 'son', 'say', 'feel', 'inside', 'bed', 'probably', 'buy', 'matt', 'topper', 'comfortable', 'use', 'better']",1,1
5.0,nikki,2025-09-10,great kid,get grandkids bunkbeds great kid lighterweight adults dont weigh 140lbs far great value kid,furniture,5.0,5.0,"['get', 'grandkids', 'bunkbeds', 'great', 'kid', 'lighterweight', 'adults', 'dont', 'weigh', '140lbs', 'far', 'great', 'value', 'kid']",1,1
1.0,artlvr64,2026-01-04,manufacturer package not good,not pack good pucture inpact easily damage mattress mine come cant get store dont order online not worth aggravation deal new mattress mess,furniture,1.0,1.0,"['not', 'pack', 'good', 'pucture', 'inpact', 'easily', 'damage', 'mattress', 'mine', 'come', 'cant', 'get', 'store', 'dont', 'order', 'online', 'not', 'worth', 'aggravation', 'deal', 'new', 'mattress', 'mess']",0,1
3.0,louise,2025-09-10,,person buy say feel spring doesnt weigh hundred pound sleep recliner instead advice dont waste money,furniture,1.0,1.0,"['person', 'buy', 'say', 'feel', 'spring', 'doesnt', 'weigh', 'hundred', 'pound', 'sleep', 'recliner', 'instead', 'advice', 'dont', 'waste', 'money']",0,0
5.0,carolyn,2025-09-08,,finally good firm supportive mattress first descent sleep long time amaze come shrink wrap snap right full size better expect thank,furniture,5.0,5.0,"['finally', 'good', 'firm', 'supportive', 'mattress', 'first', 'descent', 'sleep', 'long', 'time', 'amaze', 'come', 'shrink', 'wrap', 'snap', 'right', 'full', 'size', 'better', 'expect', 'thank']",1,1
1.0,brenda,2025-11-01,worst mattress ever,buy mattress grandson thin feel spring definitely would not ever buy recommend anyone either,furniture,1.0,1.0,"['buy', 'mattress', 'grandson', 'thin', 'feel', 'spring', 'definitely', 'would', 'not', 'ever', 'buy', 'recommend', 'anyone', 'either']",0,1
5.0,jarrett,2025-09-21,love recommend friends,mattress best sleep ive age thank price affordable great one friends want mattress,furniture,5.0,5.0,"['mattress', 'best', 'sleep', 'ive', 'age', 'thank', 'price', 'affordable', 'great', 'one', 'friends', 'want', 'mattress']",1,1
5.0,tasha,2026-02-04,zinus xl 6 twin spring mattress,amaze price really good quality stitch around mattress do double stitch feel like heavier person purchase mattress pad well extra pad,furniture,5.0,5.0,"['amaze', 'price', 'really', 'good', 'quality', 'stitch', 'around', 'mattress', 'do', 'double', 'stitch', 'feel', 'like', 'heavier', 'person', 'purchase', 'mattress', 'pad', 'well', 'extra', 'pad']",1,1
5.0,brittany,2025-09-14,mattress,get daughter floor bed comfy would wait 2 maybe 3 days lay make sure completely fill like need nice mattress,furniture,3.0,4.0,"['get', 'daughter', 'floor', 'bed', 'comfy', 'would', 'wait', '2', 'maybe', '3', 'days', 'lay', 'make', 'sure', 'completely', 'fill', 'like', 'need', 'nice', 'mattress']",1,1
1.0,walmart customer,2025-09-13,not buy ever,im deeply disappoint purchase mattress unusable spring literally keep poke back im back issue im not get value money spenth,furniture,2.0,1.0,"['im', 'deeply', 'disappoint', 'purchase', 'mattress', 'unusable', 'spring', 'literally', 'keep', 'poke', 'back', 'im', 'back', 'issue', 'im', 'not', 'get', 'value', 'money', 'spenth']",0,1
1.0,jessica,2025-07-18,terrible no support,worst bed ive ever purchase get toddler even couldnt sleep feel every single spring set floor soon lay touch grind zero support,furniture,1.0,1.0,"['worst', 'bed', 'ive', 'ever', 'purchase', 'get', 'toddler', 'even', 'couldnt', 'sleep', 'feel', 'every', 'single', 'spring', 'set', 'floor', 'soon', 'lay', 'touch', 'grind', 'zero', 'support']",0,0
5.0,walmartcustomer,2025-01-04,,mattresses lightweight sturdy easy unpack handle weve sleep two nights theyre comfortable great easy sleep arrangement kid small space,furniture,2.0,5.0,"['mattresses', 'lightweight', 'sturdy', 'easy', 'unpack', 'handle', 'weve', 'sleep', 'two', 'nights', 'theyre', 'comfortable', 'great', 'easy', 'sleep', 'arrangement', 'kid', 'small', 'space']",1,1
3.0,walmartcustomer,2025-01-11,,soft doesnt seem good quality use bed trundle bed use time child adult wouldnt sleep well,furniture,1.0,1.0,"['soft', 'doesnt', 'seem', 'good', 'quality', 'use', 'bed', 'trundle', 'bed', 'use', 'time', 'child', 'adult', 'wouldnt', 'sleep', 'well']",1,1
4.0,walmartcustomer,2024-10-08,,still not receive package delay two days big mattress know things could happen along way need mattress first delivery time need important along twin mattress order together expect arrive day,furniture,2.0,1.0,"['still', 'not', 'receive', 'package', 'delay', 'two', 'days', 'big', 'mattress', 'know', 'things', 'could', 'happen', 'along', 'way', 'need', 'mattress', 'first', 'delivery', 'time', 'need', 'important', 'along', 'twin', 'mattress', 'order', 'together', 'expect', 'arrive', 'day']",1,0
1.0,dontbuy,2025-03-05,desperate attention zinus,sell mattresss false accidently report review apologies somehow see joke someone sit back laugh dumb folks fell joke world favor please dont waste time,furniture,1.0,5.0,"['sell', 'mattresss', 'false', 'accidently', 'report', 'review', 'apologies', 'somehow', 'see', 'joke', 'someone', 'sit', 'back', 'laugh', 'dumb', 'folks', 'fell', 'joke', 'world', 'favor', 'please', 'dont', 'waste', 'time']",0,0
1.0,faelicia,2025-03-10,,3 inch not six feel spring hand good enough mattress topper another 50 get actual 6 firm sinus mattress amazon 5 months ago 20 nice regret buy realize til arrive didnt buy last time mean nice one get amazon mattress fold easily sit edge spring flatten nothing dont like firm mattress,furniture,1.0,2.0,"['3', 'inch', 'not', 'six', 'feel', 'spring', 'hand', 'good', 'enough', 'mattress', 'topper', 'another', '50', 'get', 'actual', '6', 'firm', 'sinus', 'mattress', 'amazon', '5', 'months', 'ago', '20', 'nice', 'regret', 'buy', 'realize', 'til', 'arrive', 'didnt', 'buy', 'last', 'time', 'mean', 'nice', 'one', 'get', 'amazon', 'mattress', 'fold', 'easily', 'sit', 'edge', 'spring', 'flatten', 'nothing', 'dont', 'like', 'firm', 'mattress']",1,1
2.0,walmart customer,2025-03-05,dont,okay maybe little child however purchase 2 daybed trundle hear spring sit feel theyre pop second wasnt worth 7000 best 40 ill definitely need replace near future,furniture,2.0,1.0,"['okay', 'maybe', 'little', 'child', 'however', 'purchase', '2', 'daybed', 'trundle', 'hear', 'spring', 'sit', 'feel', 'theyre', 'pop', 'second', 'wasnt', 'worth', '7000', 'best', '40', 'ill', 'definitely', 'need', 'replace', 'near', 'future']",1,1
1.0,darlaa,2025-02-21,not great,mattress pretty uncomfortable feel spring sit bed feel bar bedframe would suggest mattress topper dont even know would help im lay stomach feel spring rib,furniture,1.0,2.0,"['mattress', 'pretty', 'uncomfortable', 'feel', 'spring', 'sit', 'bed', 'feel', 'bar', 'bedframe', 'would', 'suggest', 'mattress', 'topper', 'dont', 'even', 'know', 'would', 'help', 'im', 'lay', 'stomach', 'feel', 'spring', 'rib']",0,0
5.0,mommyaj,2025-02-16,great,almost didnt buy read od reviewsbut get anywaypretty decent price get 9 year old love like picture worth money would buy kid get older,furniture,1.0,5.0,"['almost', 'didnt', 'buy', 'read', 'od', 'reviewsbut', 'get', 'anywaypretty', 'decent', 'price', 'get', '9', 'year', 'old', 'love', 'like', 'picture', 'worth', 'money', 'would', 'buy', 'kid', 'get', 'older']",1,1
1.0,anonymous,2025-03-03,terrible,mattress awful lightly run hand across top feel every spring six year old say spring keep hurt im get thick mattress topper well not firm either bouncy sharp wouldnt pay 40 top mattress thats still push,furniture,1.0,1.0,"['mattress', 'awful', 'lightly', 'run', 'hand', 'across', 'top', 'feel', 'every', 'spring', 'six', 'year', 'old', 'say', 'spring', 'keep', 'hurt', 'im', 'get', 'thick', 'mattress', 'topper', 'well', 'not', 'firm', 'either', 'bouncy', 'sharp', 'wouldnt', 'pay', '40', 'top', 'mattress', 'thats', 'still', 'push']",0,0
5.0,zena,2024-12-23,much actually memory foam,comfortable mattress great price say make memory foam honestly cant feel tell within mattress much memory foam really memory form distinctive feel comfort set apart normal feel mattress,furniture,1.0,1.0,"['comfortable', 'mattress', 'great', 'price', 'say', 'make', 'memory', 'foam', 'honestly', 'cant', 'feel', 'tell', 'within', 'mattress', 'much', 'memory', 'foam', 'really', 'memory', 'form', 'distinctive', 'feel', 'comfort', 'set', 'apart', 'normal', 'feel', 'mattress']",1,1
1.0,lindsey,2024-12-19,,uncomfortable make cheap literally feel spring without barely apply pressure imagine lay thick mattress topper help somewhat even thick mattress cover wouldnt recommend,furniture,3.0,1.0,"['uncomfortable', 'make', 'cheap', 'literally', 'feel', 'spring', 'without', 'barely', 'apply', 'pressure', 'imagine', 'lay', 'thick', 'mattress', 'topper', 'help', 'somewhat', 'even', 'thick', 'mattress', 'cover', 'wouldnt', 'recommend']",1,1
3.0,san,2025-10-18,need expense,good value deceptive description much springiness mattress not enough cushion comfort purchase necessity budget,furniture,1.0,2.0,"['good', 'value', 'deceptive', 'description', 'much', 'springiness', 'mattress', 'not', 'enough', 'cushion', 'comfort', 'purchase', 'necessity', 'budget']",1,1
1.0,nancy,2025-12-14,,terrible product literally feel spring whole body ache poorly make bed,furniture,1.0,1.0,"['terrible', 'product', 'literally', 'feel', 'spring', 'whole', 'body', 'ache', 'poorly', 'make', 'bed']",0,0
1.0,margaret,2025-12-15,not recommend,feel spring mattress need purchase foam topper not comfortable,furniture,1.0,2.0,"['feel', 'spring', 'mattress', 'need', 'purchase', 'foam', 'topper', 'not', 'comfortable']",0,1
5.0,soraya,2025-12-20,,mattress really nice little one like jump bed like firm sleep like baby comfortable,furniture,2.0,5.0,"['mattress', 'really', 'nice', 'little', 'one', 'like', 'jump', 'bed', 'like', 'firm', 'sleep', 'like', 'baby', 'comfortable']",1,1
4.0,walmartcustomer,2025-12-22,,like say previously service awful product wonderful price great service,furniture,2.0,5.0,"['like', 'say', 'previously', 'service', 'awful', 'product', 'wonderful', 'price', 'great', 'service']",1,1
5.0,walmartcustomer,2025-11-24,,need full mattress granddaughter price affordable delivery quick satisfy,furniture,1.0,5.0,"['need', 'full', 'mattress', 'granddaughter', 'price', 'affordable', 'delivery', 'quick', 'satisfy']",1,1
4.0,lindsey,2025-10-15,,not bad matterss little springy opinion son doesnt seem mind tho,furniture,2.0,3.0,"['not', 'bad', 'matterss', 'little', 'springy', 'opinion', 'son', 'doesnt', 'seem', 'mind', 'tho']",1,0
5.0,doris,2025-12-01,great bed,purchase grandson christmas parent assemble hes enjoy immensely easy assembly great preteens,furniture,4.0,5.0,"['purchase', 'grandson', 'christmas', 'parent', 'assemble', 'hes', 'enjoy', 'immensely', 'easy', 'assembly', 'great', 'preteens']",1,1
1.0,kate,2025-12-27,,would not recommend mattress buy daughters room awful thin could fold half,furniture,1.0,1.0,"['would', 'not', 'recommend', 'mattress', 'buy', 'daughters', 'room', 'awful', 'thin', 'could', 'fold', 'half']",0,1
3.0,kira,2025-12-30,,come early morning love bot exactly like picture nice may give time gully expand,furniture,4.0,4.0,"['come', 'early', 'morning', 'love', 'bot', 'exactly', 'like', 'picture', 'nice', 'may', 'give', 'time', 'gully', 'expand']",1,1
5.0,gregory,2025-11-20,,bed come long box somewhat physically limit didnt problems get set alone,furniture,2.0,3.0,"['bed', 'come', 'long', 'box', 'somewhat', 'physically', 'limit', 'didnt', 'problems', 'get', 'set', 'alone']",0,0
5.0,missy0712,2025-11-22,,mattress comfortable value great im glad stand alone without box spring highly recommend,furniture,5.0,5.0,"['mattress', 'comfortable', 'value', 'great', 'im', 'glad', 'stand', 'alone', 'without', 'box', 'spring', 'highly', 'recommend']",1,1
5.0,walmartcustomer,2025-09-09,,product awesome price could lower price get lower day buy mattress dollars,furniture,4.0,5.0,"['product', 'awesome', 'price', 'could', 'lower', 'price', 'get', 'lower', 'day', 'buy', 'mattress', 'dollars']",1,1
1.0,anonymous,2025-09-16,,product thinner expect squeak get buy 9yearold say uncomfortable,furniture,2.0,2.0,"['product', 'thinner', 'expect', 'squeak', 'get', 'buy', '9yearold', 'say', 'uncomfortable']",0,0
1.0,lorena,2025-11-02,flimsy 26 uncomfortable,not best quality feel inner spring lot heavier expect theyre flimsy make difficult move around,furniture,1.0,1.0,"['not', 'best', 'quality', 'feel', 'inner', 'spring', 'lot', 'heavier', 'expect', 'theyre', 'flimsy', 'make', 'difficult', 'move', 'around']",0,1
1.0,olivia,2025-11-05,unsatisfied,hurt shoulder need get mattress pad make sleep worthy worst mattress ive ever experience,furniture,1.0,1.0,"['hurt', 'shoulder', 'need', 'get', 'mattress', 'pad', 'make', 'sleep', 'worthy', 'worst', 'mattress', 'ive', 'ever', 'experience']",0,0
5.0,reem,2025-09-18,get,perfect price youre tight time need mattress fast great doesnt need topper,furniture,1.0,5.0,"['perfect', 'price', 'youre', 'tight', 'time', 'need', 'mattress', 'fast', 'great', 'doesnt', 'need', 'topper']",1,1
3.0,london,2025-11-13,good kid,good price bulbs definitely make kid would like firm buy kid love,furniture,4.0,4.0,"['good', 'price', 'bulbs', 'definitely', 'make', 'kid', 'would', 'like', 'firm', 'buy', 'kid', 'love']",1,1
3.0,gerald,2025-12-09,ok youre not heavy,not make grow adult would fine lightweight maybe 130lbs length good not enough support,furniture,2.0,3.0,"['not', 'make', 'grow', 'adult', 'would', 'fine', 'lightweight', 'maybe', '130lbs', 'length', 'good', 'not', 'enough', 'support']",0,1
5.0,mattie,2025-09-20,twin mattress,use foam toppers dont much decide try one far feel good,furniture,1.0,3.0,"['use', 'foam', 'toppers', 'dont', 'much', 'decide', 'try', 'one', 'far', 'feel', 'good']",1,1
3.0,jennifer,2025-10-13,wire bed,want feel wire youre lay get bed course cheap get pay,furniture,1.0,1.0,"['want', 'feel', 'wire', 'youre', 'lay', 'get', 'bed', 'course', 'cheap', 'get', 'pay']",1,1
